{
  "schemaVersion": 1,
  "kind": "compose",
  "slug": "ocean-focus",
  "displayName": "Ocean Focus",
  "origin": {"type": "minimal", "slug": "dark", "revision": "seed:dark"},
  "palette": {
    "mode": "dark",
    "accent": "#7aa2f7", "selection": "#292e42", "muted": "#414868",
    "background": "#1a1b26", "dark_background": "#13141c", "darker_background": "#0e0e14", "lighter_background": "#24283b",
    "foreground": "#a9b1d6", "dark_foreground": "#565f89", "light_foreground": "#b4bee6", "bright_foreground": "#c0caf5",
    "red": "#f7768e", "yellow": "#e0af68", "orange": "#eb927b", "green": "#9ece6a", "cyan": "#449dab", "blue": "#7aa2f7", "magenta": "#ad8ee6", "brown": "#75493d",
    "bright_red": "#ff7a93", "bright_yellow": "#ff9e64", "bright_green": "#b9f27c", "bright_cyan": "#0db9d7", "bright_blue": "#7da6ff", "bright_magenta": "#bb9af7",
    "hyprland_active_border": "rgba(7aa2f7ee) rgba(bb9af7ee) 45deg",
    "hyprland_inactive_border": null
  },
  "sections": {
    "bar": null, "controls": null, "spacing": null, "font": null, "popups": null, "tooltip": null,
    "notifications": null, "launcher": null, "menu": null, "polkit": null, "lock": null, "image-picker": null
  },
  "wallpapers": [],
  "preferredWallpaper": null,
  "iconTheme": null,
  "acceptedWarnings": [
    "themes_contrast_low:muted/background",
    "themes_contrast_low:lock.text/white",
    "themes_contrast_low:lock.placeholder/white",
    "themes_contrast_low:image-picker.text/white",
    "themes_contrast_low:controls.normal-border/surface",
    "themes_contrast_low:controls.hover-cursor-border/surface",
    "themes_contrast_low:controls.focus-border/surface",
    "themes_contrast_low:launcher.selected-border/surface",
    "themes_contrast_low:menu.selected-border/surface",
    "themes_contrast_low:image-picker.unselected-border/surface"
  ]
}
